{
  "$schema": "https://json-schema.org/draft/2020-12/schema",
  "$id": "https://srs.semanticops.com/schema/2.0/relation.json",
  "title": "SRS Relation",
  "description": "A single Relation stored as a standalone object at relations/<relationId>.json (RFC-038 Change E, [R11]). The in-file relationId is authoritative; a filename disagreeing with it is an error. Creating, updating, or deleting one Relation must not read or write any other Relation's file.",
  "type": "object",
  "required": [
    "$schema",
    "relationId",
    "relationType",
    "sourceInstanceId",
    "targetInstanceId"
  ],
  "additionalProperties": false,
  "properties": {
    "$schema": {
      "type": "string",
      "const": "https://srs.semanticops.com/schema/2.0/relation.json",
      "description": "Const-pinned schema declaration ([R11])."
    },
    "relationId": {
      "type": "string",
      "format": "uuid"
    },
    "relationType": {
      "type": "string",
      "description": "Canonical types: contains, depends-on, supersedes, refines, derived-from, evidences, precedes. Custom types use namespace/name format."
    },
    "sourceInstanceId": {
      "type": "string",
      "format": "uuid",
      "description": "The asserting instance. Reads: source [relationType] target."
    },
    "targetInstanceId": {
      "type": "string",
      "format": "uuid",
      "description": "The related instance."
    },
    "createdAt": {
      "type": "string",
      "format": "date-time"
    },
    "notes": {
      "type": "string"
    },
    "sourceRefs": {
      "type": "array",
      "items": {
        "$ref": "#/$defs/SourceReference"
      }
    },
    "meta": {
      "type": "object"
    }
  },
  "$defs": {
    "SourceReference": {
      "type": "object",
      "required": [
        "sourceType",
        "sourceId"
      ],
      "additionalProperties": false,
      "not": {
        "required": [
          "sourceRole",
          "relationType"
        ]
      },
      "allOf": [
        {
          "if": {
            "properties": { "sourceType": { "const": "repository-document" } },
            "required": ["sourceType"]
          },
          "then": {
            "properties": { "sourceId": { "format": "uuid" } }
          }
        }
      ],
      "properties": {
        "sourceType": {
          "type": "string",
          "enum": [
            "transcript-chunk",
            "transcript-segment",
            "external-document",
            "repository-document"
          ]
        },
        "sourceId": {
          "type": "string",
          "description": "Free-form when sourceType is transcript-chunk/transcript-segment/external-document. When sourceType is repository-document, MUST be a SourceDocument.documentId (format: uuid, RFC-017) — enforced by the sibling if/then."
        },
        "sourceStandard": {
          "type": "string"
        },
        "streamId": {
          "type": "string",
          "format": "uuid"
        },
        "sourceRole": {
          "type": "string",
          "enum": [
            "evidence",
            "extracted-from",
            "quoted-from",
            "inspired-by",
            "attaches"
          ],
          "description": "The role the source material plays for this instance (RFC-023). Replaces relationType. 'attaches' added by RFC-017: material attachment of a source document to a record (RFC-017 [R1])."
        },
        "relationType": {
          "type": "string",
          "deprecated": true,
          "enum": [
            "evidence",
            "derived-from",
            "quoted-from",
            "inspired-by",
            "supersedes-context"
          ],
          "description": "DEPRECATED (RFC-023): legacy name for sourceRole. Readers accept it during the migration window (SOURCEREF_LEGACY_RELATIONTYPE warning) using the RFC-023 Change B value mapping; writers must not emit it. Removed by a scheduled follow-up schema revision."
        },
        "confidence": {
          "type": "number",
          "minimum": 0,
          "maximum": 1
        },
        "note": {
          "type": "string"
        }
      }
    }
  }
}
