{
  "$schema": "https://srs.semanticops.com/schema/2.0/relation.json",
  "relationId": "4f85ecff-67e8-410d-a19e-0cae2fb67ca1",
  "relationType": "contains",
  "sourceInstanceId": "48478b98-5978-4b30-9bf9-c396c8d73886",
  "targetInstanceId": "28eebb3e-390a-4555-9faa-46bf2341fa6b",
  "createdAt": "2026-09-05T22:09:52Z"
}