{
  "$schema": "https://srs.semanticops.com/schema/2.0/relation.json",
  "relationId": "24358c32-90ab-429a-8704-6989d5fc8dcd",
  "relationType": "contains",
  "sourceInstanceId": "06a60bf4-87ef-435b-a440-a94f0e1e393d",
  "targetInstanceId": "a61d30ea-1d2b-5784-8589-9db7996f7122",
  "createdAt": "2026-09-09T21:24:28.000Z"
}