{
  "$schema": "https://srs.semanticops.com/schema/2.0/relation.json",
  "relationId": "a203f01d-4055-4aca-9833-1106210f7da7",
  "relationType": "precedes",
  "sourceInstanceId": "7041b3fb-4b26-4873-8929-094db16fb746",
  "targetInstanceId": "feefae78-5529-4626-b688-fb240fc8cf0d",
  "createdAt": "2026-09-27T20:55:05.606Z"
}