{
  "$schema": "https://srs.semanticops.com/schema/2.0/relation.json",
  "relationId": "11d64916-f3b5-485b-8209-bf4603d44aa3",
  "relationType": "contains",
  "sourceInstanceId": "af14997a-09f1-4eb2-85a9-d0262024d5de",
  "targetInstanceId": "7dfb78ce-7111-4d25-8510-312efe5effb2",
  "createdAt": "2026-09-08T11:36:54.000000000+00:00"
}