{
  "$schema": "https://srs.semanticops.com/schema/2.0/relation.json",
  "relationId": "5ace0dd8-d043-437a-b8ca-c705bd990897",
  "relationType": "contains",
  "sourceInstanceId": "7a7d8945-df7e-412e-98e0-6462b5394904",
  "targetInstanceId": "48478b98-5978-4b30-9bf9-c396c8d73886",
  "createdAt": "2026-09-05T22:09:52Z"
}