{
  "$schema": "https://srs.semanticops.com/schema/2.0/relation.json",
  "relationId": "75a7810a-f4c6-4f4c-9abe-31bf95f9b155",
  "relationType": "derived-from",
  "sourceInstanceId": "06a60bf4-87ef-435b-a440-a94f0e1e393d",
  "targetInstanceId": "e538ea64-f93f-5c51-ade0-6cd358605e8c",
  "createdAt": "2026-09-09T21:24:26.000Z"
}