{
  "$schema": "https://srs.semanticops.com/schema/2.0/relation.json",
  "relationId": "1aa737a6-a444-4d20-91ca-42a08787ab39",
  "relationType": "precedes",
  "sourceInstanceId": "495dddcd-d15d-48b4-820b-8b26fed80783",
  "targetInstanceId": "dde8bbcf-6eef-4a51-a3e3-cad205dd75d9",
  "createdAt": "2026-09-05T22:09:52Z"
}