{
  "$schema": "https://srs.semanticops.com/schema/2.0/relation.json",
  "relationId": "6c4ed1ee-13d2-4494-a92b-e83a647c9564",
  "relationType": "precedes",
  "sourceInstanceId": "4d1fa8d8-0048-4b32-ae0d-f4bccbc9e959",
  "targetInstanceId": "e538ea64-f93f-5c51-ade0-6cd358605e8c",
  "createdAt": "2026-09-09T21:22:44.000Z"
}